content	answer	dummy1	dummy2	explanation	is_opened
비담의 뜻은 무엇일까요?	비쥬얼 담당	비탈진 담벼락	비슷한 담력	비담은 비주얼 담당의 줄임말로 "여기서 비담은 나야"처럼 사용합니다.	FALSE
알부자의 뜻은 무엇일까요?	알바로 부족한 학자금을 채움	계란을 많이 사두는 사람	종아리에 알이 많은 사람	알부자는 알바로 부족한 학자금을 채움의 줄임말로 "나 알부자라 주말엔 바빠"처럼 사용합니다.	FALSE
고스팅의 뜻은 무엇일까요?	귀신처럼 잠수탐	숨어 있다가 귀신처럼 깜짝 놀래키기	고수들의 만남	고스팅은 귀신처럼 잠수탐을 의미하는 신조어로 "고스팅이 문제야"처럼 사용합니다.	FALSE
빠태의 뜻은 무엇일까요?	빠른 태세 전환	빠른 태풍	빠른 시간 안에 태어난 아이	빠태는 빠른 태세 전환의 줄임말로 "빠태 좋았다ㅋㅋ"처럼 사용합니다.	FALSE
쌉가능의 뜻은 무엇일까요?	완전 가능하다	재빠르게 행동해야만 가능하다	가격이 저렴해 모든지 다 살 수 있을 거 같은 상태	쌉가능은 완전 가능하다를 의미하는 신조어로 "걱정마 쌉가능이야"처럼 사용합니다.	FALSE
싫테의 뜻은 무엇일까요?	싫어요 테러	싫어도 티내지 말기	테이프 싫어	싫테는 싫어요 테러의 줄임말로 "싫테 하지마세요"처럼 사용합니다.	FALSE
잼민이의 뜻은 무엇일까요?	미성숙하고 무례한 행동을 하는 초등학생 	귀엽고 애교 많은 아이들을	빵에 잼 발라먹는 것을 좋아하는 아이	잼민이는 미성숙하고 무례한 행동을 하는 초등학생을 의미하는 신조어로 "너 완전 잼민이 같아"처럼 사용합니다.	FALSE
쉼포족의 뜻은 무엇일까요?	바쁜 일상 때문에 쉼을 포기한 사람	삶에 '쉼표' 즉, 휴식을 부여하는 기간	쉬다가 모든 것을 포기해버린 사람	쉼포족은 바쁜 일상 때문에 쉼을 포기한 사람의 줄임말로 "휴가보다 일을 선택하는 쉼포족"처럼 사용합니다.	FALSE
확찐자의 뜻은 무엇일까요?	코로나 시기에 살이 확 쪄버린 자	확실히 넌 살 찐 모습이 더 자연스러워	확 찐 게 자랑이냐?	확찐자는 코로나 시기에 살이 확 쪄버린 자의 줄임말로 "확찐자들을 위한 다이어트 성공 방법"처럼 사용합니다.	FALSE
돈미새의 뜻은 무엇일까요?	돈에 미친 새끼	돈 빌려줄 땐 미리 기록을 새겨야 한다	돈 냄새 맡는 새	돈미새는 돈에 미친 새끼의 줄임말로 "돈미새를 조심하자"처럼 사용합니다.	FALSE
킹리적 갓심의 뜻은 무엇일까요?	합리적 의심	매우 자신감 있는 태도	쓸데 없는 걱정	킹리적 갓심은 합리적 의심을 의미하는 신조어로 "이정도면 킹리적 갓심이야~"처럼 사용합니다.	FALSE
자강두천의 뜻은 무엇일까요?	자존심 강한 두 천재의 대결	자동차 강아지 두더지 천재	자지말고 강가에 가서 얼굴 씻고 와	자강두천은 자존심 강한 두 천재의 대결의 줄임말로 "오늘 경기 완전 자강두천이다"처럼 사용합니다.	FALSE
고인물의 뜻은 무엇일까요?	정체된 특정 집단의 사람	고양이와 인접할 땐 물러나라	고향 인정이 물론이거니와 최고이다	고인물은 정체된 특정 집단의 사람을 의미하는 신조어로 "나는 이 분야의 고인물이다"처럼 사용합니다.	FALSE
까방권의 뜻은 무엇일까요?	까임방지권	까마귀 통행을 방해하는 건물	되바라진 행동을 하는 권위적인 사람	까방권은 까임방지권의 줄임말로 "까방권 획득"처럼 사용합니다.	FALSE
돈쭐의 뜻은 무엇일까요?	돈으로 혼쭐내다	돈이 부족해서 쫄쫄 굶다	돈 많은 사람이 권위를 부리는 행태	돈쭐은 돈으로 혼쭐내다의 줄임말로 "우리 돈쭐내주자"처럼 사용합니다.	FALSE
많관부의 뜻은 무엇일까요?	많은 관심 부탁드립니다	많을수록 관대해지는 부자	많은 관심은 부담스러워	많관부는 많은 관심 부탁드립니다의 줄임말로 "오늘 공연 많관부"처럼 사용합니다.	FALSE
세젤예의 뜻은 무엇일까요?	세상에서 제일 예쁘다	세상에서 제일 예의바른 사람	세상에서 제일 예민한 사람	세젤예는 세상에서 제일 예쁘다의 줄임말로 "이거 완전 세젤예"처럼 사용합니다.	FALSE
엄근진의 뜻은 무엇일까요?	엄격하고 근엄하고 진지하다	엄마 근처로 진달래 구경 가요	엄지손가락 근데 진짜 아파	엄근진은 엄격하고 근엄하고 진지하다의 줄임말로 "엄근진 이미지"처럼 사용합니다.	FALSE
유하의 뜻은 무엇일까요?	유튜브 시청자 분들 안녕하세요	유유하고 하염없이	유명한 하숙집	유하는 유튜브 시청자 분들 안녕하세요의 줄임말로 "유하~"처럼 사용합니다.	FALSE
이왜진의 뜻은 무엇일까요?	이게 왜 진짜임?	이별할 때 왜 진지해지는거야?	이제서야 왜 진실을 말해주는 거야?	이왜진은 이게 왜 진짜?의 줄임말로 "이왜진? 가짜 아니야?"처럼 사용합니다.	FALSE
카공의 뜻은 무엇일까요?	카페에서 공부하기	자동차 공장	카메라 찍는 법 공부하기	카공은 카페에서 공부하기의 줄임말로 "나랑 같이 카공할 사람?"처럼 사용합니다.	FALSE
현타의 뜻은 무엇일까요?	현실 자각 타임	현명한 타인	현금으로 인해 타락한 사람	현타는 현실 자각 타임의 줄임말로 "현타 온다"처럼 사용합니다.	FALSE
트민남의 뜻은 무엇일까요?	트렌드에 민감한 남자	특히 민감한 남편	트위터 소식에 민첩한 남자	트민남은 트렌드에 민감한 남자의 줄임말로 "트민남이 선택한 음식"처럼 사용합니다.	FALSE
주린이의 뜻은 무엇일까요?	주식투자 초보자	굶주리는 어린이	주말에 공부하는 어린이	주린이는 주식투자 초보자를 의미하는 신조어로 "주린이가 꼭 알아야 할 것"처럼 사용합니다.	FALSE
뉴비의 뜻은 무엇일까요?	인터넷에서 활동한 지 얼마 안 되어 서투른 사람	새로운 비즈니스 파트너	뉴스와 비행기	뉴비는 인터넷에서 활동한 지 얼마 안 되어 서투른 사람을 의미하는 신조어로 "나는 아직 뉴비야"처럼 사용합니다.	FALSE
덕통사고의 뜻은 무엇일까요?	교통사고처럼 우연하고 갑작스럽게 어떤 분야의 팬이나 마니아가 됨	덕수궁에서 통풍 때문에 발생한 사고	덕질하다가 앞을 보지 못해 당하는 교통 사고	덕통사고는 교통사고처럼 우연하고 갑작스럽게 어떤 분야의 팬이나 마니아가 되는 것을 의미하는 신조어로 "아이돌 덕통사고 당했다"처럼 사용합니다.	FALSE
딸바보의 뜻은 무엇일까요?	딸 앞에서 바보가 될 정도로 딸을 너무나도 사랑하는 엄마나 아빠	멍청해서 바보가 된 딸	딸이 바보가 되지 않게 노력하는 엄마나 아빠	딸바보는 딸 앞에서 바보가 되는 사람의 줄임말로 "우리 아빠는 딸바보이다"처럼 사용합니다.	FALSE
능지의 뜻은 무엇일까요?	지능	능숙하게 지도하는 사람	능력을 펼칠 시기는 바로 지금	능지는 지능을 의미하는 신조어로 "능지 올랐네"처럼 사용합니다.	FALSE